{
  "profile_schema_version": "1.0.0",
  "dataset_profile_version": "1.4.0-reviewed",
  "dataset_id": "sick",
  "display_name": "UCI Thyroid Disease — Sick",
  "dataset_version": "uci-102-a0982569a744",
  "dataset_view": "sick-uci-102-model-v1",
  "dataset_family": "health-classification",
  "status": "reviewed",
  "owners": ["repository-maintainers"],
  "review_record": {
    "source_schema_split_preprocessing": "reviewed",
    "privacy_metric_and_suite_admission": "pending",
    "date": "2026-08-03"
  },
  "change_log": [
    {
      "version": "1.0.0-reviewed",
      "change": "Replaced the unverified 2,205-row derivative with the checksum-pinned official UCI train/test files."
    },
    {
      "version": "1.1.0-reviewed",
      "change": "Added the machine-readable P3 hard column validity contract while leaving medical ranges and semantic constraints unresolved."
    },
    {
      "version": "1.2.0-reviewed",
      "change": "Added the reviewed diagnostic P4 Local and Global Utility declarations."
    },
    {
      "version": "1.3.0-reviewed",
      "change": "Excluded the constant TBG_measured field from Global Utility with an explicit non-predictive-target reason after official-split cardinality review."
    },
    {
      "version": "1.4.0-reviewed",
      "change": "Bound P4 Utility to the row-order-invariant evaluator profile with an explicit seeded internal validation split."
    }
  ],
  "suite_membership": ["diagnostic"],
  "official_eligible": false,
  "source_rights": {
    "canonical_source": "https://archive.ics.uci.edu/dataset/102/thyroid+disease",
    "publisher": "UCI Machine Learning Repository",
    "source_version": "uci-102-sha256-a0982569a744",
    "retrieved_date": "2026-08-03",
    "raw_files": [
      {
        "name": "thyroid-disease.zip",
        "role": "source-archive",
        "sha256": "a0982569a7442c03a20815db58f271245e7a111b10ac46f6c6b5fa6feee4c1f4"
      },
      {
        "name": "sick.data",
        "role": "official-train",
        "sha256": "81d4e8ae85233d453afc3ac721cfc5af8d83c0e8cd39d70aa9923089022f2c02"
      },
      {
        "name": "sick.test",
        "role": "official-test",
        "sha256": "e618b0a41f6df17ff297c8fbf7d15e8d97b37397d26e784e708ebb2297613018"
      },
      {
        "name": "sick.names",
        "role": "official-schema",
        "sha256": "00ca5bfcdba355c910ab311de4b2dd3f4e344628435922aba1dec8427bfcf7ea"
      }
    ],
    "citation": "Quinlan, R. (1986). Thyroid Disease [Dataset]. UCI Machine Learning Repository. https://doi.org/10.24432/C5D010.",
    "license": "CC-BY-4.0",
    "access_restrictions": [],
    "permitted_uses": ["research", "benchmarking", "redistribution-with-attribution"],
    "redistribution_status": "permitted",
    "modification_requirements": ["Mark the model-input table as a processed view of the official source."],
    "attribution_requirements": ["Retain the UCI citation and CC BY 4.0 attribution."],
    "rights_review": {
      "decision": "source-recorded-pending-independent-release-review",
      "reviewer": "repository-maintainers",
      "date": "2026-08-03"
    }
  },
  "table_contract": {
    "canonical_serialization": "UTF-8 CSV with LF line endings",
    "encoding": "ASCII source; UTF-8 processed view",
    "delimiter": ",",
    "row_count_expectations": {"train": 2800, "test": 972},
    "unique_column_names": true,
    "canonical_column_order": [
      "age", "sex", "on_thyroxine", "query_on_thyroxine", "on_antithyroid_medication", "sick",
      "pregnant", "thyroid_surgery", "I131_treatment", "query_hypothyroid", "query_hyperthyroid",
      "lithium", "goitre", "tumor", "hypopituitary", "psych", "TSH_measured", "TSH", "T3_measured",
      "T3", "TT4_measured", "TT4", "T4U_measured", "T4U", "FTI_measured", "FTI", "TBG_measured",
      "referral_source", "Class"
    ],
    "duplicate_row_policy": "Preserve the official fixed split. Record IDs must be unique, but repeated model rows are retained and disclosed in the split audit.",
    "identifier_policy": "Parse the |record suffix for split auditing, then exclude it from model input and published CSV tables.",
    "target_presence": ["Class"],
    "missing_value_inventory": "Locked per split in sick-uci-102-v1.json; TBG is entirely missing and excluded.",
    "supported_input_forms": ["checksum-pinned UCI archive"],
    "canonical_table_checksum": null
  },
  "columns": [
    {"name":"age","column_id":"age","semantic_type":"continuous","storage_type":"float64","roles":["feature","quasi_identifier"],"nullable_raw":true,"nullable_model_input":false,"valid_domain":null,"category_vocabulary_source":null,"transformation_policy":"Train-split arithmetic-mean imputation.","inverse_transformation_policy":"No inverse imputation; generated output is validated as finite.","description":"Age recorded by the official source.","unit":"years","sensitivity":{"status":"provisional","sensitive":true,"quasi_identifier":true},"constraint_refs":[]},
    {"name":"sex","column_id":"sex","semantic_type":"categorical","storage_type":"string","roles":["feature","sensitive_attribute"],"nullable_raw":true,"nullable_model_input":false,"valid_domain":{"values":["M","F"]},"category_vocabulary_source":"sick.names","transformation_policy":"Train-split most-frequent imputation.","inverse_transformation_policy":"Generated values must belong to the declared domain.","description":"Sex category in the official source.","unit":null,"sensitivity":{"status":"provisional","sensitive":true,"quasi_identifier":true},"constraint_refs":[]},
    {"name":"on_thyroxine","column_id":"on-thyroxine","semantic_type":"boolean","storage_type":"string","roles":["feature"],"nullable_raw":false,"nullable_model_input":false,"valid_domain":{"values":["f","t"]},"category_vocabulary_source":"sick.names","transformation_policy":"Identity.","inverse_transformation_policy":"Require f or t.","description":"Whether the subject is on thyroxine.","unit":null,"sensitivity":{"status":"provisional","sensitive":true,"quasi_identifier":false},"constraint_refs":[]},
    {"name":"query_on_thyroxine","column_id":"query-on-thyroxine","semantic_type":"boolean","storage_type":"string","roles":["feature"],"nullable_raw":false,"nullable_model_input":false,"valid_domain":{"values":["f","t"]},"category_vocabulary_source":"sick.names","transformation_policy":"Identity.","inverse_transformation_policy":"Require f or t.","description":"Query-on-thyroxine indicator.","unit":null,"sensitivity":{"status":"provisional","sensitive":true,"quasi_identifier":false},"constraint_refs":[]},
    {"name":"on_antithyroid_medication","column_id":"on-antithyroid-medication","semantic_type":"boolean","storage_type":"string","roles":["feature"],"nullable_raw":false,"nullable_model_input":false,"valid_domain":{"values":["f","t"]},"category_vocabulary_source":"sick.names","transformation_policy":"Identity.","inverse_transformation_policy":"Require f or t.","description":"Antithyroid-medication indicator.","unit":null,"sensitivity":{"status":"provisional","sensitive":true,"quasi_identifier":false},"constraint_refs":[]},
    {"name":"sick","column_id":"sick-feature","semantic_type":"boolean","storage_type":"string","roles":["feature"],"nullable_raw":false,"nullable_model_input":false,"valid_domain":{"values":["f","t"]},"category_vocabulary_source":"sick.names","transformation_policy":"Identity.","inverse_transformation_policy":"Require f or t.","description":"Source feature named sick; distinct from the Class target.","unit":null,"sensitivity":{"status":"provisional","sensitive":true,"quasi_identifier":false},"constraint_refs":[]},
    {"name":"pregnant","column_id":"pregnant","semantic_type":"boolean","storage_type":"string","roles":["feature","sensitive_attribute"],"nullable_raw":false,"nullable_model_input":false,"valid_domain":{"values":["f","t"]},"category_vocabulary_source":"sick.names","transformation_policy":"Identity.","inverse_transformation_policy":"Require f or t.","description":"Pregnancy indicator.","unit":null,"sensitivity":{"status":"provisional","sensitive":true,"quasi_identifier":false},"constraint_refs":[]},
    {"name":"thyroid_surgery","column_id":"thyroid-surgery","semantic_type":"boolean","storage_type":"string","roles":["feature"],"nullable_raw":false,"nullable_model_input":false,"valid_domain":{"values":["f","t"]},"category_vocabulary_source":"sick.names","transformation_policy":"Identity.","inverse_transformation_policy":"Require f or t.","description":"Thyroid-surgery indicator.","unit":null,"sensitivity":{"status":"provisional","sensitive":true,"quasi_identifier":false},"constraint_refs":[]},
    {"name":"I131_treatment","column_id":"i131-treatment","semantic_type":"boolean","storage_type":"string","roles":["feature"],"nullable_raw":false,"nullable_model_input":false,"valid_domain":{"values":["f","t"]},"category_vocabulary_source":"sick.names","transformation_policy":"Identity.","inverse_transformation_policy":"Require f or t.","description":"I131-treatment indicator.","unit":null,"sensitivity":{"status":"provisional","sensitive":true,"quasi_identifier":false},"constraint_refs":[]},
    {"name":"query_hypothyroid","column_id":"query-hypothyroid","semantic_type":"boolean","storage_type":"string","roles":["feature"],"nullable_raw":false,"nullable_model_input":false,"valid_domain":{"values":["f","t"]},"category_vocabulary_source":"sick.names","transformation_policy":"Identity.","inverse_transformation_policy":"Require f or t.","description":"Query-hypothyroid indicator.","unit":null,"sensitivity":{"status":"provisional","sensitive":true,"quasi_identifier":false},"constraint_refs":[]},